question,answer,expected_phrases
"What do you enjoy most about your current job?","What I enjoy most about my current job is the opportunity to work on challenging projects that push me to develop my skills and think creatively. I also appreciate the collaborative environment and the chance to work with a talented and supportive team. The company culture that values innovation and continuous improvement is another aspect that I find highly motivating.","enjoy current job, challenging projects, develop skills, think creatively, collaborative environment, talented team, supportive team, company culture, values innovation, continuous improvement, motivating"
"How do you handle tight deadlines and high-pressure situations?","When faced with tight deadlines and high-pressure situations, I prioritize tasks based on urgency and importance. I break down the work into smaller, manageable steps and set specific time goals for each step. Clear communication with my team and stakeholders is crucial to ensure everyone is aligned and working efficiently. I also make sure to take short breaks to stay focused and avoid burnout. Staying organized and maintaining a positive attitude helps me navigate high-pressure situations successfully.","tight deadlines, high-pressure situations, prioritize tasks, urgency, importance, manageable steps, time goals, clear communication, team alignment, efficiency, short breaks, focused, avoid burnout, organized, positive attitude, successful navigation"
"Describe a situation where you had to learn a new tool or technology quickly.","In a previous role, we adopted a new CRM system that was crucial for managing customer interactions and sales processes. I had no prior experience with this system, so I dedicated time to learning it quickly by attending training sessions, exploring online resources, and practicing with the software. Within a few weeks, I became proficient and was able to train my colleagues, which ensured a smooth transition and improved our overall efficiency.","new tool, new technology, CRM system, customer interactions, sales processes, learning quickly, training sessions, online resources, practicing, proficient, train colleagues, smooth transition, improved efficiency"
"What are your salary expectations?","Based on my research and understanding of the industry standards, I am looking for a salary in the range of [specific range], which I believe reflects my experience, skills, and the responsibilities of the role. However, I am open to discussing this further to find a mutually agreeable compensation package.","salary expectations, industry standards, specific range, experience, skills, responsibilities, open to discussion, mutually agreeable compensation"
"What makes you unique?","What makes me unique is my combination of technical expertise and strong interpersonal skills. I have a proven track record in [specific field] and am highly skilled in [relevant technologies/skills]. Additionally, my ability to communicate effectively with both technical and non-technical stakeholders sets me apart. I am also deeply passionate about [relevant topic], which drives me to continuously improve and contribute innovative solutions to my team.","unique, technical expertise, interpersonal skills, proven track record, specific field, relevant technologies, effective communication, technical stakeholders, non-technical stakeholders, passionate, relevant topic, continuous improvement, innovative solutions"
"How do you build relationships with colleagues?","I build relationships with colleagues by being approachable, open, and supportive. I make an effort to get to know my teammates on both a professional and personal level. Regular check-ins, collaborative projects, and social activities help strengthen our connections. I also value open communication and actively listen to others' ideas and concerns, which fosters trust and mutual respect.","build relationships, colleagues, approachable, open, supportive, professional level, personal level, regular check-ins, collaborative projects, social activities, open communication, active listening, trust, mutual respect"
"What is your greatest professional accomplishment?","My greatest professional accomplishment was leading a team to develop and launch a new software product that addressed a significant market need. We faced tight deadlines and technical challenges, but through effective project management and teamwork, we delivered a high-quality product on time. The product received positive feedback from users and resulted in a significant increase in revenue for the company.","greatest accomplishment, professional, leading team, develop software product, market need, tight deadlines, technical challenges, effective project management, teamwork, high-quality product, on time, positive feedback, increased revenue"
