question,answer,expected_phrases
"Tell me about yourself.","I graduated with a degree in Computer Science from XYZ University and have over five years of experience in software development. I started my career at ABC Company, where I worked on several web development projects. I am particularly skilled in JavaScript, Python, and React. In my most recent role at DEF Corporation, I led a team to develop a new customer service platform that increased our efficiency by 30%. I am passionate about coding, problem-solving, and continuously learning new technologies.","Computer Science, XYZ University, five years, software development, ABC Company, web development, JavaScript, Python, React, DEF Corporation, customer service platform, coding, problem-solving, learning new technologies"
"What are your strengths?","My strengths include strong analytical and problem-solving skills, excellent communication, and the ability to work effectively in team settings. I am also very adaptable and quick to learn new technologies. For instance, in my last job, I taught myself React and applied it to a project that significantly improved our front-end performance.","analytical skills, problem-solving, communication, teamwork, adaptable, learning new technologies, React, front-end performance"
"What is your greatest weakness?","One area I am working to improve is delegating tasks. I tend to take on too much myself because I want to ensure everything is done perfectly. However, I’ve been learning to trust my team more and delegate effectively. I've seen that this not only helps the team develop their skills but also ensures that projects run smoothly and efficiently.","delegating tasks, team trust, delegate effectively, team skills, project efficiency"
"Describe a challenging situation you faced and how you handled it.","In my previous role, we had a critical project with a very tight deadline, and halfway through, a key team member left unexpectedly. This put a lot of pressure on the team. I took the initiative to reassign tasks and worked closely with the remaining team members to fill in the gaps. We also communicated openly with our client to manage their expectations. By putting in extra hours and staying focused, we managed to deliver the project on time and received positive feedback from the client.","critical project, tight deadline, team member left, reassign tasks, team communication, client expectations, extra hours, project delivery, positive feedback"
"Why do you want to work here?","I have always admired your company's innovative approach to technology and commitment to quality. After researching more about your projects and company culture, I feel that my skills and values align perfectly with your team. I am particularly excited about the opportunity to work on [specific project] because of [reason]. I believe I can contribute significantly to your team and grow professionally in this dynamic environment.","innovative approach, commitment to quality, company culture, skills align, excited, specific project, contribute, grow professionally"
"Where do you see yourself in five years?","In five years, I see myself in a leadership role within the company, having taken on greater responsibilities and successfully led several high-impact projects. I aim to have continued to grow my technical skills and to have contributed to innovative solutions that drive the company forward. I also hope to mentor new team members and help them develop their careers.","leadership role, greater responsibilities, high-impact projects, technical skills, innovative solutions, drive company forward, mentor, career development"
"How do you handle pressure and stress?","I handle pressure and stress by staying organized and maintaining a positive mindset. I prioritize my tasks, break them down into manageable parts, and tackle them one by one. I also make sure to take short breaks to clear my mind and stay focused. When faced with particularly stressful situations, I find that open communication with my team helps to distribute the workload and find collaborative solutions.","organized, positive mindset, prioritize tasks, manageable parts, short breaks, focus, open communication, distribute workload, collaborative solutions"
"Give an example of a time you showed leadership.","During a major project at my last job, our project manager was out on medical leave, and I was asked to step in. I took charge of coordinating the team, setting deadlines, and ensuring we stayed on track. I facilitated daily stand-up meetings to keep everyone aligned and motivated. By fostering a collaborative environment and being available to support my team, we successfully completed the project on time and received commendation from the client.","leadership, project manager, coordinating team, setting deadlines, daily stand-up meetings, collaborative environment, team support, project completion, client commendation"
"How do you stay current with industry trends?","I stay current with industry trends by regularly reading tech blogs, following influential figures in the tech community on social media, and participating in webinars and conferences. I am also an active member of several professional networks and attend local meetups and workshops. Additionally, I dedicate time to taking online courses to continuously upgrade my skills.","industry trends, tech blogs, influential figures, social media, webinars, conferences, professional networks, meetups, workshops, online courses, upgrade skills"
"Do you have any questions for us?","Yes, I do. Could you tell me more about the team I would be working with and the primary challenges they are currently facing? Also, what are the opportunities for professional development within the company? Lastly, can you describe the company culture and the typical career path for someone in this role?","team, challenges, professional development, company culture, career path"
"Can you describe your ideal work environment?","My ideal work environment is one that is collaborative, innovative, and supportive. I thrive in settings where there is open communication, a focus on teamwork, and opportunities for continuous learning and growth. I also appreciate a workplace that values work-life balance and fosters a positive and inclusive culture.","collaborative, innovative, supportive, open communication, teamwork, continuous learning, growth, work-life balance, positive culture, inclusive culture"
"What motivates you?","I am motivated by challenges and the opportunity to solve complex problems. I enjoy setting and achieving goals, and I find satisfaction in delivering high-quality work that makes a positive impact. Additionally, continuous learning and professional growth are significant motivators for me.","challenges, complex problems, achieving goals, high-quality work, positive impact, continuous learning, professional growth"
"How do you prioritize your work?","I prioritize my work by first identifying the most critical tasks and deadlines. I use a combination of tools, such as to-do lists and project management software, to keep track of my responsibilities. I also break down larger tasks into smaller, manageable steps and tackle them systematically. Regularly reviewing and adjusting my priorities helps me stay on track and meet my objectives.","critical tasks, deadlines, to-do lists, project management software, responsibilities, manageable steps, systematic approach, reviewing priorities, meeting objectives"
"Can you give an example of how you handled a conflict at work?","In a previous job, there was a disagreement between two team members about the best approach to a project. I facilitated a meeting where each person could present their perspective. We discussed the pros and cons of each approach and ultimately reached a compromise that incorporated the best elements of both ideas. This not only resolved the conflict but also resulted in a better project outcome.","conflict resolution, disagreement, facilitated meeting, perspectives, pros and cons, compromise, best elements, better outcome"
"How do you approach problem-solving?","I approach problem-solving by first thoroughly understanding the problem and gathering all relevant information. I then brainstorm potential solutions, considering both short-term and long-term impacts. I evaluate the feasibility and risks of each option and choose the most effective solution. Finally, I implement the solution and monitor the results to ensure the problem is resolved.","problem-solving, understanding problem, gathering information, brainstorming solutions, short-term impact, long-term impact, feasibility, risks, effective solution, implementation, monitoring results"
"What are your long-term career goals?","My long-term career goals include advancing to a senior leadership position where I can influence the strategic direction of the company. I also aim to continue developing my technical and managerial skills, contribute to innovative projects, and mentor others in their professional growth. Ultimately, I want to make a significant impact in my field and help drive the success of the organization.","senior leadership, strategic direction, technical skills, managerial skills, innovative projects, mentor, professional growth, significant impact, success of organization"
"Describe a time when you had to learn a new skill quickly.","In my last role, we decided to implement a new project management software that none of us had used before. I took the initiative to learn the software quickly by attending webinars, reading the documentation, and practicing using it. I then trained the rest of the team, created user guides, and provided ongoing support. This ensured a smooth transition and improved our project management processes.","new skill, project management software, initiative, webinars, documentation, practicing, training team, user guides, ongoing support, smooth transition, improved processes"
"How do you handle feedback?","I handle feedback by viewing it as an opportunity for growth and improvement. I listen carefully to the feedback, ask clarifying questions if needed, and reflect on how I can apply it to my work. I also appreciate constructive criticism and strive to make the necessary adjustments. By embracing feedback, I continuously improve my performance and contribute more effectively to the team.","feedback, growth opportunity, improvement, listening, clarifying questions, applying feedback, constructive criticism, adjustments, performance improvement, team contribution"
"Why are you leaving your current job?","I have enjoyed my time at my current job and have learned a lot, but I am looking for new challenges and opportunities for growth. I believe that your company offers the kind of environment and projects that align with my career aspirations. I am particularly excited about the potential to work on innovative projects and contribute to a dynamic team.","new challenges, opportunities for growth, career aspirations, environment, innovative projects, dynamic team"
"How do you manage multiple projects at once?","I manage multiple projects by prioritizing tasks based on their deadlines and importance. I use project management tools to keep track of each project's progress and ensure nothing falls through the cracks. Effective time management, regular progress reviews, and clear communication with team members are also key strategies I employ to stay on top of multiple projects.","multiple projects, prioritizing tasks, deadlines, project management tools, progress tracking, time management, progress reviews, clear communication, team members"
"What would you do if you disagreed with a decision made by your manager?","If I disagreed with a decision made by my manager, I would first try to understand their perspective and the reasoning behind their decision. Then, I would respectfully express my concerns and present any alternative solutions that I believe could be beneficial. I believe open communication and a constructive approach are essential in such situations to reach a mutual understanding and the best outcome for the team.","disagreement, manager decision, understanding perspective, respectful expression, alternative solutions, open communication, constructive approach, mutual understanding, best outcome"
"How do you handle tight deadlines?","When faced with tight deadlines, I focus on efficient time management and clear prioritization of tasks. I break down the work into smaller, manageable chunks and allocate specific time slots to each task. I also communicate with my team to ensure everyone is aligned and can support each other if needed. Staying organized and keeping a calm mindset helps me meet deadlines without compromising on quality.","tight deadlines, time management, task prioritization, manageable chunks, time allocation, team communication, alignment, support, organization, calm mindset, quality"
"What do you consider to be your biggest professional achievement?","One of my biggest professional achievements was leading a project that significantly improved our company's customer satisfaction scores. By implementing new processes and tools, we reduced response times and increased overall efficiency. The project not only met but exceeded our initial goals, and it was recognized as a key success by our senior management.","professional achievement, leading project, customer satisfaction, new processes, new tools, reduced response times, increased efficiency, exceeded goals, key success, senior management recognition"
"What is your approach to continuous learning and professional development?","I believe in the importance of continuous learning and regularly seek out opportunities for professional development. This includes attending industry conferences, enrolling in online courses, and participating in professional networks. I also set aside time for reading relevant books and articles. By staying informed and acquiring new skills, I ensure that I remain competitive and can contribute effectively to my team.","continuous learning, professional development, industry conferences, online courses, professional networks, reading, staying informed, acquiring new skills, competitiveness, effective contribution"
"What makes you a good fit for this role?","I believe my background in [specific field], combined with my experience in [related experience], makes me a great fit for this role. I have demonstrated my ability to [key skills] and have a track record of [related accomplishments]. Additionally, I am passionate about [relevant topic] and am eager to contribute to [company/department] by [specific contribution].","background, specific field, related experience, key skills, related accomplishments, passionate, relevant topic, eager to contribute, specific contribution"
"How do you ensure quality in your work?","To ensure quality in my work, I follow a structured approach that includes thorough planning, consistent review processes, and attention to detail. I utilize checklists and project management tools to stay organized and track progress. Additionally, I seek feedback from colleagues and stakeholders to identify areas for improvement. Regularly updating my skills and knowledge also helps me maintain high standards of quality.","ensure quality, structured approach, thorough planning, consistent review, attention to detail, checklists, project management tools, feedback, improvement, updating skills, high standards"
"What strategies do you use to stay motivated?","To stay motivated, I set clear and achievable goals and break them down into smaller, manageable tasks. I also find it helpful to celebrate small victories along the way, which keeps me energized and focused. Maintaining a healthy work-life balance and engaging in activities I enjoy outside of work also contribute to my overall motivation and well-being.","stay motivated, clear goals, manageable tasks, celebrate victories, energized, focused, work-life balance, engaging activities, motivation, well-being"
"Can you describe a time when you had to adapt to a significant change at work?","During a major restructuring at my previous company, our team had to adapt to new roles and responsibilities. I embraced the change by taking the initiative to learn new skills and technologies relevant to my new position. I also helped my colleagues adjust by sharing knowledge and providing support. This proactive approach ensured a smooth transition and helped our team maintain productivity.","adapt to change, major restructuring, new roles, new responsibilities, learning new skills, new technologies, sharing knowledge, providing support, smooth transition, maintain productivity"
"How do you handle failure?","When I encounter failure, I take it as an opportunity to learn and grow. I analyze what went wrong and identify areas for improvement. I also seek feedback from others to gain different perspectives and ensure that I avoid making the same mistakes in the future. By maintaining a positive attitude and being open to learning, I turn failures into valuable learning experiences.","handle failure, opportunity to learn, grow, analyze, identify improvement, feedback, perspectives, avoid mistakes, positive attitude, learning experiences"
"What is your experience with remote work?","I have extensive experience with remote work, having spent the past two years working from home. I have developed strong communication and time management skills, which are essential for remote work. I utilize various collaboration tools to stay connected with my team and ensure that we remain productive. I have also created a dedicated workspace at home to minimize distractions and maintain a professional environment.","remote work experience, communication skills, time management, collaboration tools, connected with team, productive, dedicated workspace, minimize distractions, professional environment"
"How do you handle constructive criticism?","I handle constructive criticism by listening carefully and keeping an open mind. I appreciate feedback as it helps me identify areas for improvement and grow professionally. After receiving constructive criticism, I reflect on it and make necessary changes to my approach or work. This continuous improvement mindset allows me to enhance my skills and contribute more effectively to my team.","constructive criticism, listening, open mind, feedback, identify improvement, grow professionally, reflect, necessary changes, continuous improvement, enhance skills, effective contribution"
"Describe a project where you had to collaborate with different departments.","In my previous job, I led a project that required collaboration with the marketing, sales, and IT departments. We had to develop a new product launch strategy. I organized cross-departmental meetings to align our goals and ensure clear communication. By leveraging the expertise of each department, we created a successful launch plan that met our targets and received positive feedback from senior management.","collaborate, different departments, marketing, sales, IT, product launch strategy, cross-departmental meetings, clear communication, leveraging expertise, successful launch, positive feedback"
"What do you do to maintain a healthy work-life balance?","To maintain a healthy work-life balance, I set clear boundaries between work and personal time. I make sure to take regular breaks throughout the day and prioritize activities that help me relax and recharge, such as exercise and spending time with family. I also plan my work schedule to ensure that I have time for hobbies and interests outside of work.","work-life balance, clear boundaries, personal time, regular breaks, relax, recharge, exercise, family time, work schedule, hobbies, interests"
"How do you approach setting and achieving goals?","I approach setting and achieving goals by first defining clear, specific, and achievable objectives. I break down each goal into smaller tasks and create a timeline with milestones to track progress. Regularly reviewing my goals and adjusting my plans as needed helps me stay on track. I also seek feedback and support from colleagues to ensure that I am making progress and staying motivated.","setting goals, achieving goals, clear objectives, specific, achievable, break down tasks, timeline, milestones, track progress, reviewing goals, adjusting plans, feedback, support, stay motivated"
"Describe a situation where you went above and beyond for a client or project.","In a previous role, a key client faced an unexpected issue just before a major deadline. I took the initiative to work overtime and coordinate with my team to resolve the problem. We provided regular updates to the client to keep them informed. Our efforts not only met the deadline but also exceeded the client's expectations, resulting in positive feedback and a strengthened business relationship.","above and beyond, key client, unexpected issue, major deadline, initiative, work overtime, team coordination, resolve problem, regular updates, exceeded expectations, positive feedback, strengthened relationship"
"What steps do you take to ensure effective communication in your team?","To ensure effective communication in my team, I prioritize regular and clear communication. I set up weekly team meetings to discuss progress, challenges, and upcoming tasks. I also encourage open and honest feedback and make sure to actively listen to team members' concerns. Utilizing collaboration tools and creating a shared space for documents and resources also helps streamline communication and keep everyone informed.","effective communication, regular communication, weekly team meetings, discuss progress, challenges, upcoming tasks, open feedback, active listening, collaboration tools, shared space, informed"
"What role do you typically play in a team setting?","In a team setting, I typically take on the role of a facilitator and coordinator. I enjoy bringing people together, ensuring that everyone's voice is heard, and helping the team stay organized and on track. I also focus on fostering a positive and collaborative environment where team members feel supported and motivated to contribute their best work.","team setting, facilitator, coordinator, bringing people together, voice heard, organized, on track, positive environment, collaborative environment, supported, motivated, best work"
"How do you manage your time and prioritize tasks?","I manage my time and prioritize tasks by using a combination of to-do lists and project management tools. I start by identifying the most critical tasks and deadlines, then break them down into smaller, manageable steps. I allocate specific time slots for each task and regularly review and adjust my priorities based on progress and any changes in deadlines. Staying organized and focused helps me complete my work efficiently.","manage time, prioritize tasks, to-do lists, project management tools, critical tasks, deadlines, manageable steps, time slots, review priorities, organized, focused, efficient work"
"Can you provide an example of a successful project you managed?","In my previous job, I managed a project to redesign our company's website. The goal was to improve user experience and increase online engagement. I coordinated with designers, developers, and content creators to ensure we met our objectives. By setting clear milestones and maintaining open communication, we completed the project on time and within budget. The new website received positive feedback from users and resulted in a 20% increase in engagement.","successful project, managed, website redesign, user experience, online engagement, coordination, designers, developers, content creators, clear milestones, open communication, on time, within budget, positive feedback, increased engagement"
"How do you keep yourself organized?","I keep myself organized by using a combination of digital tools and traditional methods. I rely on project management software to track tasks and deadlines, and I also use a physical planner for daily to-do lists and notes. Regularly reviewing my tasks and priorities helps me stay on top of my responsibilities. Additionally, maintaining a clean and orderly workspace contributes to my overall organization and productivity.","organized, digital tools, traditional methods, project management software, track tasks, deadlines, physical planner, to-do lists, notes, reviewing tasks, priorities, responsibilities, clean workspace, orderly workspace, productivity"
"What steps do you take to ensure the success of a project?","To ensure the success of a project, I start with thorough planning and goal-setting. I define clear objectives and create a detailed project plan with timelines and milestones. I also assemble a skilled team and ensure open communication throughout the project. Regular progress reviews and adjustments help keep the project on track. Finally, I focus on quality control to ensure that the final deliverables meet or exceed expectations.","success of project, thorough planning, goal-setting, clear objectives, detailed project plan, timelines, milestones, skilled team, open communication, progress reviews, adjustments, quality control, final deliverables, exceed expectations"
